{"acceptance_criteria":[{"id":"AC-001","source_refs":["SRC-PLAN"],"text":"Existing error text and exit code remain compatible"},{"id":"AC-002","source_refs":["SRC-PLAN"],"text":"Invalid source completeness reports exact source field in structured error_path"},{"id":"AC-003","source_refs":["SRC-PLAN"],"text":"Unknown/missing field diagnostics expose a stable explicit path"},{"id":"AC-004","source_refs":["SRC-PLAN"],"text":"Successful output remains unchanged"}],"assumptions":["Area is explicitly selected by human; remote Area relationship is not independently verified","The exact diagnostic case comes from human-confirmed OB-EVAL, with the Notion Plan supplying integration requirements","Diagnostic baseline frozen after Capsule validation repairs; original proposed case and ceilings unchanged."],"compiler_version":"omnia-contract-compiler/1","confirmation_ref":"belay:EVD-ae60bd4fda1b275020c5298a54405199","constraints":["Single Belay repository; modify only helper/tests/documentation","Preserve existing output on success and original error text/exit code","Use fixed source snapshot and confirmed case; no source reinterpretation"],"context_refs":["SRC-PLAN"],"contract_digest":"sha256:57f6467d37842bf6d42d5d7c10534c79d887693dd7362722118e5316d9ac6c17","contract_id":"OMNIA-DOGFOOD-001","delegation":{"actor":"Codex implementation under native sandbox","allowed_operations":["local code edit","local tests","local fixture commit","Evidence record"],"scope":"scripts/omnia_contract.py tests/omnia_contract/test_contract.py and diagnostic documentation"},"expires_at":"2026-10-08T12:17:51Z","input_id":"INPUT-DOGFOOD-001","input_revision":1,"issued_at":"2026-10-01T12:17:51Z","lifecycle":"active","non_goals":["Publication, tag push, registry release, user installation","Erwin or installed consumer edits","Automatic Notion status or Decision promotion"],"outcome":"Add machine-readable exact failing field path to Contract helper validation diagnostics","requirements":[{"id":"REQ-001","source_refs":["SRC-PLAN"],"text":"Human-confirmed OB-EVAL Code case: add structured exact failing field path; existing error text and exit behavior remain compatible."}],"revision":1,"schema_version":1,"source_bundle":{"acquisition_digest":"sha256:008c3a0765c546d4ceb2adfe6c9b97616c8d307052db9012d5db5da4f90f0591","bundle_digest":"sha256:cd7b8bac8b07749e46bb0282570549d7a82e4f4bd4c16fd82fc292235a672deb","bundle_id":"BUNDLE-DOGFOOD-001","sources":[{"complete":true,"edited_at":"2026-09-30T12:51:00Z","id":"SRC-PLAN","normalized_sha256":"sha256:c426571eefea1e3f03abc41d60be8d12f7e4f8a4d01b869aebac62980c94fc28","raw_sha256":"sha256:e5a01113b6f1059e4b8379b6a89085249004bcaf7fc30eb39cf82c67390b084b","raw_snapshot_ref":".belay/local-sources/SRC-PLAN-20261001T121123Z.json","retrieved_at":"2026-10-01T12:11:23Z","url":"https://app.notion.com/p/Omnia-Belay-Integration-3b8c2ad7b43180d7a0a8d78e58d2392b"}]},"stop_conditions":["Mandatory source unavailable/incomplete or meaning changed","Cancellation, supersede, expiry or human stop","Any action outside delegated paths or external write without specific permission"],"target":{"base_commit":"f48e67339890f56af2bdb78b1bb4355f5aa250e3","repository":"github.com/Ars-Transitus/belay-trace"},"unknowns":[],"verification":["Focused Python tests including exact invalid field paths and successful-output compatibility","Independent review of exact changed artifact","Capsule lists all four AC and their exact Evidence bindings"]}
