{"acceptance_criteria":[{"id":"AC-001","source_refs":["SRC-001"],"text":"Repeated compilation yields identical UTF-8 bytes"}],"assumptions":["All source references are synthetic"],"compiler_version":"omnia-contract-compiler/1","confirmation_ref":"synthetic://human-confirmation/001","constraints":["Read local synthetic snapshots only","Use the fixed issuance timestamp"],"context_refs":["SRC-001"],"contract_digest":"sha256:c3abb1d7de52d8bcc8abe632bbce823e56dc6b6e15ada2845db6cb2dc47e1b2c","contract_id":"OMNIA-DEMO-001","delegation":{"actor":"synthetic-compiler","allowed_operations":["validate","compile","preview"],"scope":"OB-02/03 fixture"},"expires_at":"2026-10-08T00:00:00Z","input_id":"INPUT-DEMO-001","input_revision":1,"issued_at":"2026-10-01T00:00:00Z","lifecycle":"active","non_goals":["Apply projections","Fetch external sources"],"outcome":"Compile a deterministic read-only synthetic contract","requirements":[{"id":"REQ-001","source_refs":["SRC-001"],"text":"Compilation is deterministic"}],"revision":1,"schema_version":1,"source_bundle":{"bundle_digest":"sha256:23d37bea435683fabd0a9a54db44a678963deb8859e029724975182a782199e4","bundle_id":"SYNTHETIC-BUNDLE-001","sources":[{"complete":true,"edited_at":"2026-09-30T23:00:00Z","id":"SRC-001","normalized_sha256":"sha256:cccccccccccccccccccccccccccccccccccccccccccccccccccccccccccccccc","raw_sha256":"sha256:bbbbbbbbbbbbbbbbbbbbbbbbbbbbbbbbbbbbbbbbbbbbbbbbbbbbbbbbbbbbbbbb","raw_snapshot_ref":"local-untracked://synthetic/source-001.json","retrieved_at":"2026-10-01T00:00:00Z","url":"synthetic://omnia/confirmed-input"}]},"stop_conditions":["Stop if a source is incomplete","Stop before any external mutation"],"target":{"base_commit":"457136c4c1861742d195c8e881823630ad7ebd00","repository":"github.com/Ars-Transitus/belay-trace"},"unknowns":[],"verification":["Run focused Python unittest","Compare canonical golden bytes"]}
